<?xml version="1.0" encoding="utf-8"?>
<Content
  Version="4.0"
  xsi:schemaLocation="http://schemas.ntreev.com/crema/tables/sub-modules/NtreevLibrary ../Templates/StringTable.xsd"
  StringTable.Creator="admin"
  StringTable.CreatedDateTime="2017-10-23T07:16:01.2646706Z"
  StringTable.ModifiedDateTime="2018-01-26T05:04:28.2807632Z"
  StringTable.Count="25"
  StringTable.ID="c0cab95d-e8db-454e-bfdd-db225b55d79e" xmlns:xsi="http://www.w3.org/2001/XMLSchema-instance" xmlns="http://schemas.ntreev.com/crema/tables/Templates/StringTable">
  <StringTable
    Creator="admin"
    CreatedDateTime="2017-11-06T23:48:25.3943089Z"
    Modifier="admin"
    ModifiedDateTime="2017-11-07T00:20:09.894855Z">
    <Type>Exception</Type>
    <Name>AlreadyRegisteredProperty_Format</Name>
    <Value>Property '{0}' is already registered.</Value>
    <ko_KR>'{0}' 속성은 이미 등록되어 있습니다.</ko_KR>
  </StringTable>
  <StringTable
    Creator="admin"
    CreatedDateTime="2017-11-06T23:49:46.6412517Z"
    Modifier="admin"
    ModifiedDateTime="2017-11-07T00:20:03.3584435Z">
    <Type>Exception</Type>
    <Name>NotFoundProperty_Format</Name>
    <Value>Property '{0}' does not exist.</Value>
    <ko_KR>'{0}' 속성은 존재하지 않습니다.</ko_KR>
  </StringTable>
  <StringTable
    Creator="admin"
    CreatedDateTime="2017-11-06T23:52:46.9795686Z"
    Modifier="admin"
    ModifiedDateTime="2017-11-07T00:19:51.720823Z">
    <Type>Exception</Type>
    <Name>InvalidPropertyType_Format</Name>
    <Value>Type '{0}' can not be used as property.</Value>
    <ko_KR>'{0}' 속성은 사용할 수 없습니다.</ko_KR>
  </StringTable>
  <StringTable
    Creator="admin"
    CreatedDateTime="2017-11-06T23:54:05.9157072Z"
    Modifier="admin"
    ModifiedDateTime="2017-11-07T00:19:37.2283976Z">
    <Type>Exception</Type>
    <Name>UndefinedValue_Format</Name>
    <Value>Value '{0}' is not defined.</Value>
    <ko_KR>'{0}' 값은 정의되어 있지 않습니다.</ko_KR>
  </StringTable>
  <StringTable
    Creator="admin"
    CreatedDateTime="2017-11-06T23:58:06.5325299Z"
    Modifier="admin"
    ModifiedDateTime="2017-11-06T23:58:37.827185Z">
    <Type>Exception</Type>
    <Name>NotFoundDirectory_Format</Name>
    <Value>Path '{0}' could not be found.</Value>
    <ko_KR>'{0}' 경로를 찾을 수 없습니다.</ko_KR>
  </StringTable>
  <StringTable
    Creator="admin"
    CreatedDateTime="2017-11-06T23:59:10.4312422Z"
    Modifier="admin"
    ModifiedDateTime="2017-11-06T23:59:19.9160589Z">
    <Type>Exception</Type>
    <Name>NotIncludedParentPath</Name>
    <Value>The path to the file does not include the parent path.</Value>
    <ko_KR>파일 경로에 부모 경로가 포함되어 있지 않습니다.</ko_KR>
  </StringTable>
  <StringTable
    Creator="admin"
    CreatedDateTime="2017-11-07T00:00:05.5939392Z"
    Modifier="admin"
    ModifiedDateTime="2017-11-07T00:00:15.5467566Z">
    <Type>Exception</Type>
    <Name>InvalidPath</Name>
    <Value>Invalid path.</Value>
    <ko_KR>잘못된 경로입니다.</ko_KR>
  </StringTable>
  <StringTable
    Creator="admin"
    CreatedDateTime="2017-11-07T00:21:58.1756452Z"
    Modifier="admin"
    ModifiedDateTime="2017-11-07T00:22:50.8891378Z">
    <Type>Exception</Type>
    <Name>InvalidPath_Format</Name>
    <Value>'{0}' is invalid path.</Value>
    <ko_KR>'{0}' 은(는) 잘못된 경로입니다.</ko_KR>
  </StringTable>
  <StringTable
    Creator="admin"
    CreatedDateTime="2017-11-07T00:01:17.8532661Z"
    Modifier="admin"
    ModifiedDateTime="2017-11-07T01:59:03.60648Z">
    <Type>Exception</Type>
    <Name>CyclicDependency</Name>
    <Value>Cyclic dependency found.</Value>
    <ko_KR>주기적 종속성을 발견했습니다.</ko_KR>
  </StringTable>
  <StringTable
    Creator="admin"
    CreatedDateTime="2017-11-07T00:18:11.1152463Z"
    Modifier="admin"
    ModifiedDateTime="2017-11-07T00:19:25.512777Z">
    <Type>Exception</Type>
    <Name>NotSupportedType_Format</Name>
    <Value>Type '{0} is not supported.</Value>
    <ko_KR>'{0}' 타입은 지원되지 않습니다.</ko_KR>
  </StringTable>
  <StringTable
    Creator="admin"
    CreatedDateTime="2017-11-07T00:20:59.1295415Z"
    Modifier="admin"
    ModifiedDateTime="2017-11-07T00:21:14.3083682Z">
    <Type>Exception</Type>
    <Name>Between0and1</Name>
    <Value>Values between 0 and 1 must be used.</Value>
    <ko_KR>0 과 1사이의 값을 사용해야 합니다.</ko_KR>
  </StringTable>
  <StringTable
    Creator="admin"
    CreatedDateTime="2017-11-07T00:24:26.5339059Z"
    Modifier="admin"
    ModifiedDateTime="2017-11-07T02:03:52.5989877Z">
    <Type>Exception</Type>
    <Name>InvalidName</Name>
    <Value>Name can not include special characters \ / : * ? &lt; &gt; | etc.</Value>
    <ko_KR>이름에 특수문자 \ / : * ? " &lt; &gt; | 등은 포함될 수 없습니다.</ko_KR>
  </StringTable>
  <StringTable
    Creator="admin"
    CreatedDateTime="2017-11-07T00:25:24.8156083Z"
    Modifier="s2quake"
    ModifiedDateTime="2018-01-11T06:29:07.6857211Z">
    <Type>Exception</Type>
    <Name>AlreadyExistedItem_Format</Name>
    <Value>Item '{0}' is already existed.</Value>
    <ko_KR>'{0}' 항목은 이미 존재합니다.</ko_KR>
  </StringTable>
  <StringTable
    Creator="admin"
    CreatedDateTime="2017-11-07T00:26:59.3995744Z"
    Modifier="admin"
    ModifiedDateTime="2017-11-07T00:27:13.392799Z">
    <Type>Exception</Type>
    <Name>SameItemInParent</Name>
    <Value>Item with same name exists in parent folder.</Value>
    <ko_KR>부모 폴더에 이름이 같은 항목이 존재합니다.</ko_KR>
  </StringTable>
  <StringTable
    Creator="admin"
    CreatedDateTime="2017-11-07T00:27:44.0780529Z"
    Modifier="admin"
    ModifiedDateTime="2017-11-07T00:27:56.651675Z">
    <Type>Exception</Type>
    <Name>SameFolderInParent</Name>
    <Value>Folder with same name exists in parent folder.</Value>
    <ko_KR>부모 폴더에 이름이 같은 폴더가 존재합니다.</ko_KR>
  </StringTable>
  <StringTable
    Creator="admin"
    CreatedDateTime="2017-11-07T00:28:15.5755083Z"
    Modifier="admin"
    ModifiedDateTime="2017-11-07T00:30:25.165936Z">
    <Type>Exception</Type>
    <Name>NotFoundFolder_Format</Name>
    <Value>Folder '{0}' could not be found.</Value>
    <ko_KR>'{0}' 폴더를 찾을 수 없습니다.</ko_KR>
  </StringTable>
  <StringTable
    Creator="admin"
    CreatedDateTime="2017-11-07T00:47:00.5814848Z"
    Modifier="admin"
    ModifiedDateTime="2017-11-07T00:47:18.2719159Z">
    <Type>Exception</Type>
    <Name>IndestructibleObject</Name>
    <Value>Indestructible Object</Value>
    <ko_KR>삭제할 수 없습니다.</ko_KR>
  </StringTable>
  <StringTable
    Creator="admin"
    CreatedDateTime="2017-11-07T02:00:22.1068179Z"
    Modifier="admin"
    ModifiedDateTime="2017-11-07T02:00:25.6480241Z">
    <Type>Message</Type>
    <Name>Completed</Name>
    <Value>Completed.</Value>
    <ko_KR>완료되었습니다.</ko_KR>
  </StringTable>
  <StringTable
    Creator="admin"
    CreatedDateTime="2017-11-07T02:04:45.3582803Z"
    Modifier="admin"
    ModifiedDateTime="2017-11-07T02:05:08.8363216Z">
    <Type>Exception</Type>
    <Name>EmptyStringCannotBeUsedAsName</Name>
    <Value>Empty string can not be used as a name.</Value>
    <ko_KR>빈 문자열을 이름으로 사용할 수 없습니다.</ko_KR>
  </StringTable>
  <StringTable
    Creator="admin"
    CreatedDateTime="2017-11-07T02:07:41.4367897Z"
    Modifier="admin"
    ModifiedDateTime="2017-11-07T02:08:00.7662237Z">
    <Type>Exception</Type>
    <Name>NotFoundItem_Format</Name>
    <Value>Item '{0}' could not be found.</Value>
    <ko_KR>'{0}' 항목을 찾을 수 없습니다.</ko_KR>
  </StringTable>
  <StringTable
    Creator="admin"
    CreatedDateTime="2017-11-07T02:09:32.1989843Z"
    Modifier="admin"
    ModifiedDateTime="2017-11-07T02:10:04.5690412Z">
    <Type>Exception</Type>
    <Name>UniqueObjectCannotRename</Name>
    <Value>You can not rename objects whose unique name property is set.</Value>
    <ko_KR>고유 이름 속성이 설정된 객체는 이름을 변경할 수 없습니다.</ko_KR>
  </StringTable>
  <StringTable
    Creator="admin"
    CreatedDateTime="2017-11-07T02:10:45.8155136Z"
    Modifier="admin"
    ModifiedDateTime="2017-11-07T02:11:10.0579562Z">
    <Type>Exception</Type>
    <Name>InvalidName_Format</Name>
    <Value>'{0}' is invalid name</Value>
    <ko_KR>'{0}' 은(는) 잘못된 이름입니다.</ko_KR>
  </StringTable>
  <StringTable
    Creator="admin"
    CreatedDateTime="2017-11-07T02:15:32.313017Z"
    Modifier="admin"
    ModifiedDateTime="2017-11-07T02:15:40.7214318Z">
    <Type>Exception</Type>
    <Name>ChildFolderCannotBeSetAsParent</Name>
    <Value>Child folders in folders can not be set as parents.</Value>
    <ko_KR>폴더의 하위 폴더는 부모로 설정할 수 없습니다.</ko_KR>
  </StringTable>
  <StringTable
    Creator="admin"
    CreatedDateTime="2017-11-07T02:16:27.9427147Z"
    Modifier="admin"
    ModifiedDateTime="2017-11-07T02:19:26.5494285Z">
    <Type>Exception</Type>
    <Name>UnnamedFolderCannotHaveParent</Name>
    <Value>A folder without a name can not be set up by a parent folder.</Value>
    <ko_KR>이름이 없는 폴더는 부모 폴더를 설정할 수 없습니다.</ko_KR>
  </StringTable>
  <StringTable
    Creator="admin"
    CreatedDateTime="2017-11-07T02:20:42.4903619Z"
    Modifier="admin"
    ModifiedDateTime="2017-11-07T02:21:17.0610227Z">
    <Type>Exception</Type>
    <Name>CannotBeSetItSelfAsParent</Name>
    <Value>Unable to set self to parent folder.</Value>
    <ko_KR>자기 자신을 부모 폴더로 설정할 수 없습니다.</ko_KR>
  </StringTable>
</Content>